{
  "reviews": [
    {
      "taskId": "SFR-002-T01",
      "reviewer": "기획 리드",
      "reviewedAt": "2026-09-25T09:00:00.000Z",
      "note": "착수 검토 회의 확인"
    }
  ],
  "notes": {},
  "work": {
    "ia:PUB": {
      "status": "DONE",
      "at": "2026-09-25T09:00:00.000Z",
      "by": "기획 리드",
      "note": ""
    },
    "ia:CVL": {
      "status": "DONE",
      "at": "2026-09-25T09:00:00.000Z",
      "by": "기획 리드",
      "note": ""
    },
    "ia:ADM": {
      "status": "DONE",
      "at": "2026-09-25T09:00:00.000Z",
      "by": "기획 리드",
      "note": ""
    },
    "ds:PUB": {
      "status": "DONE",
      "at": "2026-09-25T09:00:00.000Z",
      "by": "기획 리드",
      "note": ""
    },
    "ds:CVL": {
      "status": "DONE",
      "at": "2026-09-25T09:00:00.000Z",
      "by": "기획 리드",
      "note": ""
    },
    "ds:ADM": {
      "status": "DONE",
      "at": "2026-09-25T09:00:00.000Z",
      "by": "기획 리드",
      "note": ""
    },
    "sb:PUB_INF_LST_010": {
      "status": "DONE",
      "at": "2026-09-25T09:00:00.000Z",
      "by": "기획 리드",
      "note": ""
    },
    "sb:PUB_INF_DTL_010": {
      "status": "DONE",
      "at": "2026-09-25T09:00:00.000Z",
      "by": "기획 리드",
      "note": ""
    },
    "sb:CVL_INF_REG_010": {
      "status": "DONE",
      "at": "2026-09-25T09:00:00.000Z",
      "by": "기획 리드",
      "note": ""
    },
    "sb:CVL_INF_STS_010": {
      "status": "DONE",
      "at": "2026-09-25T09:00:00.000Z",
      "by": "기획 리드",
      "note": ""
    },
    "sb:ADM_INF_REV_010": {
      "status": "DONE",
      "at": "2026-09-25T09:00:00.000Z",
      "by": "기획 리드",
      "note": ""
    },
    "sb:ADM_INF_HIS_010": {
      "status": "DONE",
      "at": "2026-09-25T09:00:00.000Z",
      "by": "기획 리드",
      "note": ""
    },
    "flow:SFR-002": {
      "status": "DONE",
      "at": "2026-09-25T09:00:00.000Z",
      "by": "기획 리드",
      "note": ""
    }
  },
  "history": [
    {
      "requirementId": "SFR-001",
      "at": "2026-09-25T09:00:00.000Z",
      "kind": "ADDED",
      "detail": "민원인 회원가입 및 로그인"
    },
    {
      "requirementId": "SFR-001",
      "at": "2026-09-25T09:00:00.000Z",
      "kind": "TASKS_CHANGED",
      "detail": "SFR-001-T01 추가 [CVL] 회원가입(본인인증)"
    },
    {
      "requirementId": "SFR-001",
      "at": "2026-09-25T09:00:00.000Z",
      "kind": "TASKS_CHANGED",
      "detail": "SFR-001-T02 추가 [CVL] 로그인"
    },
    {
      "requirementId": "SFR-002",
      "at": "2026-09-25T09:00:00.000Z",
      "kind": "ADDED",
      "detail": "대국민 정보공개"
    },
    {
      "requirementId": "SFR-002",
      "at": "2026-09-25T09:00:00.000Z",
      "kind": "TASKS_CHANGED",
      "detail": "SFR-002-T01 추가 [CVL] 자료 등록 및 공개 신청"
    },
    {
      "requirementId": "SFR-002",
      "at": "2026-09-25T09:00:00.000Z",
      "kind": "TASKS_CHANGED",
      "detail": "SFR-002-T02 추가 [ADM] 신청 목록 조회 및 내용 검토"
    },
    {
      "requirementId": "SFR-002",
      "at": "2026-09-25T09:00:00.000Z",
      "kind": "TASKS_CHANGED",
      "detail": "SFR-002-T03 추가 [ADM] 승인 또는 반려(사유 입력)"
    },
    {
      "requirementId": "SFR-002",
      "at": "2026-09-25T09:00:00.000Z",
      "kind": "TASKS_CHANGED",
      "detail": "SFR-002-T04 추가 [CVL] 처리 결과 확인, 반려 시 보완 후 재신청"
    },
    {
      "requirementId": "SFR-002",
      "at": "2026-09-25T09:00:00.000Z",
      "kind": "TASKS_CHANGED",
      "detail": "SFR-002-T05 추가 [PUB] 공개 목록·상세 조회"
    },
    {
      "requirementId": "SFR-002",
      "at": "2026-09-25T09:00:00.000Z",
      "kind": "TASKS_CHANGED",
      "detail": "SFR-002-T06 추가 [EXT] 국가 정보공개 포털로 공개 자료 전송"
    },
    {
      "requirementId": "SFR-003",
      "at": "2026-09-25T09:00:00.000Z",
      "kind": "ADDED",
      "detail": "심사 이력 관리"
    },
    {
      "requirementId": "SFR-003",
      "at": "2026-09-25T09:00:00.000Z",
      "kind": "TASKS_CHANGED",
      "detail": "SFR-003-T01 추가 [ADM] 자료별 심사 이력 조회"
    },
    {
      "requirementId": "SFR-004",
      "at": "2026-09-25T09:00:00.000Z",
      "kind": "ADDED",
      "detail": "처리 결과 모바일 알림"
    },
    {
      "requirementId": "SFR-005",
      "at": "2026-09-25T09:00:00.000Z",
      "kind": "ADDED",
      "detail": "타 기관 자료 일괄 수집"
    },
    {
      "requirementId": "SFR-005",
      "at": "2026-09-25T09:00:00.000Z",
      "kind": "EXCLUDED",
      "detail": "2차 사업 범위로 이관(착수보고 회의 결정)"
    },
    {
      "requirementId": "SFR-006",
      "at": "2026-09-25T09:00:00.000Z",
      "kind": "ADDED",
      "detail": "정보공개 청구 신청"
    },
    {
      "requirementId": "SFR-006",
      "at": "2026-09-25T09:00:00.000Z",
      "kind": "TASKS_CHANGED",
      "detail": "SFR-006-T01 자동 생성 [CVL] 자료 작성·등록 및 신청"
    },
    {
      "requirementId": "SFR-006",
      "at": "2026-09-25T09:00:00.000Z",
      "kind": "TASKS_CHANGED",
      "detail": "SFR-006-T02 자동 생성 [ADM] 신청 목록 조회 및 내용 검토"
    },
    {
      "requirementId": "SFR-006",
      "at": "2026-09-25T09:00:00.000Z",
      "kind": "TASKS_CHANGED",
      "detail": "SFR-006-T03 자동 생성 [ADM] 승인 또는 반려(사유 입력)"
    },
    {
      "requirementId": "SFR-006",
      "at": "2026-09-25T09:00:00.000Z",
      "kind": "TASKS_CHANGED",
      "detail": "SFR-006-T04 자동 생성 [CVL] 처리 결과 확인, 반려 시 보완 후 재신청"
    },
    {
      "requirementId": "SFR-006",
      "at": "2026-09-25T09:00:00.000Z",
      "kind": "TASKS_CHANGED",
      "detail": "SFR-006-T05 자동 생성 [PUB] 공개 목록·상세 조회"
    },
    {
      "requirementId": "SFR-006",
      "at": "2026-09-25T09:00:00.000Z",
      "kind": "TASKS_CHANGED",
      "detail": "SFR-006-T06 자동 생성 [CVL] 처리 결과 알림 발송"
    },
    {
      "requirementId": "SFR-006",
      "at": "2026-09-25T09:00:00.000Z",
      "kind": "TASKS_CHANGED",
      "detail": "SFR-006-T07 자동 생성 [EXT] 외부 연계 전송"
    }
  ]
}
